{
  "schemaVersion": "1.0",
  "version": "list-price-2026-08-27",
  "priceType": "list-price-snapshot",
  "rates": [
    {
      "provider": "OpenAI",
      "model": "gpt-5.4",
      "deploymentType": "GlobalStandard",
      "meterName": "5.4 inp Gl 1M Tokens",
      "skuName": "5.4 inp Gl",
      "armSkuName": "54 inp Gl",
      "tokenType": "uncached_input",
      "unit": "USD per 1M tokens",
      "listPrice": 2.5,
      "currency": "USD",
      "validFrom": "2026-08-27T00:00:00Z",
      "validTo": null,
      "sourceUri": "https://prices.azure.com/api/retail/prices?$filter=productName%20eq%20%27Azure%20OpenAI%20GPT5%27%20and%20contains(skuName,%20%275.4%27)",
      "retrievedAt": "2026-08-27T00:00:00Z",
      "sourceHash": "sha256:d20fae434ca9af002043a1fdb64e9ec81055e5c503b301969bc9ff13ac9c1788",
      "version": "list-price-2026-08-27"
    },
    {
      "provider": "OpenAI",
      "model": "gpt-5.4",
      "deploymentType": "GlobalStandard",
      "meterName": "5.4 cd inp Gl 1M Tokens",
      "skuName": "5.4 cd inp Gl",
      "armSkuName": "54 cd inp Gl",
      "tokenType": "cached_input",
      "unit": "USD per 1M tokens",
      "listPrice": 0.25,
      "currency": "USD",
      "validFrom": "2026-08-27T00:00:00Z",
      "validTo": null,
      "sourceUri": "https://prices.azure.com/api/retail/prices?$filter=productName%20eq%20%27Azure%20OpenAI%20GPT5%27%20and%20contains(skuName,%20%275.4%27)",
      "retrievedAt": "2026-08-27T00:00:00Z",
      "sourceHash": "sha256:d20fae434ca9af002043a1fdb64e9ec81055e5c503b301969bc9ff13ac9c1788",
      "version": "list-price-2026-08-27"
    },
    {
      "provider": "OpenAI",
      "model": "gpt-5.4",
      "deploymentType": "GlobalStandard",
      "meterName": "5.4 opt Gl 1M Tokens",
      "skuName": "5.4 opt Gl",
      "armSkuName": "54 opt Gl",
      "tokenType": "output",
      "unit": "USD per 1M tokens",
      "listPrice": 15.0,
      "currency": "USD",
      "validFrom": "2026-08-27T00:00:00Z",
      "validTo": null,
      "sourceUri": "https://prices.azure.com/api/retail/prices?$filter=productName%20eq%20%27Azure%20OpenAI%20GPT5%27%20and%20contains(skuName,%20%275.4%27)",
      "retrievedAt": "2026-08-27T00:00:00Z",
      "sourceHash": "sha256:d20fae434ca9af002043a1fdb64e9ec81055e5c503b301969bc9ff13ac9c1788",
      "version": "list-price-2026-08-27"
    },
    {
      "provider": "OpenAI",
      "model": "gpt-5.4-mini",
      "deploymentType": "GlobalStandard",
      "meterName": "5.4 mini Inp Gl 1M Tokens",
      "skuName": "5.4 mini Inp Gl",
      "armSkuName": "54 mini Inp Gl",
      "tokenType": "uncached_input",
      "unit": "USD per 1M tokens",
      "listPrice": 0.75,
      "currency": "USD",
      "validFrom": "2026-08-27T00:00:00Z",
      "validTo": null,
      "sourceUri": "https://prices.azure.com/api/retail/prices?$filter=productName%20eq%20%27Azure%20OpenAI%20GPT5%27%20and%20contains(skuName,%20%275.4%27)",
      "retrievedAt": "2026-08-27T00:00:00Z",
      "sourceHash": "sha256:d20fae434ca9af002043a1fdb64e9ec81055e5c503b301969bc9ff13ac9c1788",
      "version": "list-price-2026-08-27"
    },
    {
      "provider": "OpenAI",
      "model": "gpt-5.4-mini",
      "deploymentType": "GlobalStandard",
      "meterName": "5.4 mini cd Inp Gl 1M Tokens",
      "skuName": "5.4 mini cd Inp Gl",
      "armSkuName": "54 mini cd Inp Gl",
      "tokenType": "cached_input",
      "unit": "USD per 1M tokens",
      "listPrice": 0.075,
      "currency": "USD",
      "validFrom": "2026-08-27T00:00:00Z",
      "validTo": null,
      "sourceUri": "https://prices.azure.com/api/retail/prices?$filter=productName%20eq%20%27Azure%20OpenAI%20GPT5%27%20and%20contains(skuName,%20%275.4%27)",
      "retrievedAt": "2026-08-27T00:00:00Z",
      "sourceHash": "sha256:d20fae434ca9af002043a1fdb64e9ec81055e5c503b301969bc9ff13ac9c1788",
      "version": "list-price-2026-08-27"
    },
    {
      "provider": "OpenAI",
      "model": "gpt-5.4-mini",
      "deploymentType": "GlobalStandard",
      "meterName": "5.4 mini Opt Gl 1M Tokens",
      "skuName": "5.4 mini Opt Gl",
      "armSkuName": "54 mini Opt Gl",
      "tokenType": "output",
      "unit": "USD per 1M tokens",
      "listPrice": 4.5,
      "currency": "USD",
      "validFrom": "2026-08-27T00:00:00Z",
      "validTo": null,
      "sourceUri": "https://prices.azure.com/api/retail/prices?$filter=productName%20eq%20%27Azure%20OpenAI%20GPT5%27%20and%20contains(skuName,%20%275.4%27)",
      "retrievedAt": "2026-08-27T00:00:00Z",
      "sourceHash": "sha256:d20fae434ca9af002043a1fdb64e9ec81055e5c503b301969bc9ff13ac9c1788",
      "version": "list-price-2026-08-27"
    },
    {
      "provider": "OpenAI",
      "model": "gpt-5.4-nano",
      "deploymentType": "GlobalStandard",
      "meterName": "5.4 nano Inp Gl 1M Tokens",
      "skuName": "5.4 nano Inp Gl",
      "armSkuName": "54 nano Inp Gl",
      "tokenType": "uncached_input",
      "unit": "USD per 1M tokens",
      "listPrice": 0.2,
      "currency": "USD",
      "validFrom": "2026-08-27T00:00:00Z",
      "validTo": null,
      "sourceUri": "https://prices.azure.com/api/retail/prices?$filter=productName%20eq%20%27Azure%20OpenAI%20GPT5%27%20and%20contains(skuName,%20%275.4%27)",
      "retrievedAt": "2026-08-27T00:00:00Z",
      "sourceHash": "sha256:d20fae434ca9af002043a1fdb64e9ec81055e5c503b301969bc9ff13ac9c1788",
      "version": "list-price-2026-08-27"
    },
    {
      "provider": "OpenAI",
      "model": "gpt-5.4-nano",
      "deploymentType": "GlobalStandard",
      "meterName": "5.4 nano cd Inp Gl 1M Tokens",
      "skuName": "5.4 nano cd Inp Gl",
      "armSkuName": "54 nano cd Inp Gl",
      "tokenType": "cached_input",
      "unit": "USD per 1M tokens",
      "listPrice": 0.02,
      "currency": "USD",
      "validFrom": "2026-08-27T00:00:00Z",
      "validTo": null,
      "sourceUri": "https://prices.azure.com/api/retail/prices?$filter=productName%20eq%20%27Azure%20OpenAI%20GPT5%27%20and%20contains(skuName,%20%275.4%27)",
      "retrievedAt": "2026-08-27T00:00:00Z",
      "sourceHash": "sha256:d20fae434ca9af002043a1fdb64e9ec81055e5c503b301969bc9ff13ac9c1788",
      "version": "list-price-2026-08-27"
    },
    {
      "provider": "OpenAI",
      "model": "gpt-5.4-nano",
      "deploymentType": "GlobalStandard",
      "meterName": "5.4 nano Opt Gl 1M Tokens",
      "skuName": "5.4 nano Opt Gl",
      "armSkuName": "54 nano Opt Gl",
      "tokenType": "output",
      "unit": "USD per 1M tokens",
      "listPrice": 1.25,
      "currency": "USD",
      "validFrom": "2026-08-27T00:00:00Z",
      "validTo": null,
      "sourceUri": "https://prices.azure.com/api/retail/prices?$filter=productName%20eq%20%27Azure%20OpenAI%20GPT5%27%20and%20contains(skuName,%20%275.4%27)",
      "retrievedAt": "2026-08-27T00:00:00Z",
      "sourceHash": "sha256:d20fae434ca9af002043a1fdb64e9ec81055e5c503b301969bc9ff13ac9c1788",
      "version": "list-price-2026-08-27"
    },
    {
      "provider": "Anthropic",
      "model": "claude-opus-5",
      "deploymentType": "GlobalStandard",
      "tokenType": "uncached_input",
      "unit": "USD per 1M tokens",
      "listPrice": 5.0,
      "currency": "USD",
      "validFrom": "2026-08-27T00:00:00Z",
      "validTo": null,
      "sourceUri": "https://platform.claude.com/docs/en/about-claude/pricing",
      "retrievedAt": "2026-08-27T00:00:00Z",
      "sourceHash": "sha256:9a4f988ca3fa2a9e4046f9f7a219cdadb5c110470c3eab18f29e4b2b6ea6e337",
      "version": "list-price-2026-08-27"
    },
    {
      "provider": "Anthropic",
      "model": "claude-opus-5",
      "deploymentType": "GlobalStandard",
      "tokenType": "cache_write_5m",
      "unit": "USD per 1M tokens",
      "listPrice": 6.25,
      "currency": "USD",
      "validFrom": "2026-08-27T00:00:00Z",
      "validTo": null,
      "sourceUri": "https://platform.claude.com/docs/en/about-claude/pricing",
      "retrievedAt": "2026-08-27T00:00:00Z",
      "sourceHash": "sha256:9a4f988ca3fa2a9e4046f9f7a219cdadb5c110470c3eab18f29e4b2b6ea6e337",
      "version": "list-price-2026-08-27"
    },
    {
      "provider": "Anthropic",
      "model": "claude-opus-5",
      "deploymentType": "GlobalStandard",
      "tokenType": "cache_write_1h",
      "unit": "USD per 1M tokens",
      "listPrice": 10.0,
      "currency": "USD",
      "validFrom": "2026-08-27T00:00:00Z",
      "validTo": null,
      "sourceUri": "https://platform.claude.com/docs/en/about-claude/pricing",
      "retrievedAt": "2026-08-27T00:00:00Z",
      "sourceHash": "sha256:9a4f988ca3fa2a9e4046f9f7a219cdadb5c110470c3eab18f29e4b2b6ea6e337",
      "version": "list-price-2026-08-27"
    },
    {
      "provider": "Anthropic",
      "model": "claude-opus-5",
      "deploymentType": "GlobalStandard",
      "tokenType": "cache_read",
      "unit": "USD per 1M tokens",
      "listPrice": 0.5,
      "currency": "USD",
      "validFrom": "2026-08-27T00:00:00Z",
      "validTo": null,
      "sourceUri": "https://platform.claude.com/docs/en/about-claude/pricing",
      "retrievedAt": "2026-08-27T00:00:00Z",
      "sourceHash": "sha256:9a4f988ca3fa2a9e4046f9f7a219cdadb5c110470c3eab18f29e4b2b6ea6e337",
      "version": "list-price-2026-08-27"
    },
    {
      "provider": "Anthropic",
      "model": "claude-opus-5",
      "deploymentType": "GlobalStandard",
      "tokenType": "output",
      "unit": "USD per 1M tokens",
      "listPrice": 25.0,
      "currency": "USD",
      "validFrom": "2026-08-27T00:00:00Z",
      "validTo": null,
      "sourceUri": "https://platform.claude.com/docs/en/about-claude/pricing",
      "retrievedAt": "2026-08-27T00:00:00Z",
      "sourceHash": "sha256:9a4f988ca3fa2a9e4046f9f7a219cdadb5c110470c3eab18f29e4b2b6ea6e337",
      "version": "list-price-2026-08-27"
    }
  ]
}
